{
  "schema_version": "1.1",
  "run_id": "run-parallel-001",
  "agent": "jira_triage_agent",
  "created_at_ms": 1750250000000,
  "mode": "record",
  "parent_run_id": null,
  "fork_step_id": null,
  "status": "ok",
  "duration_ms": 1820,
  "steps": [
    {
      "step_id": 1,
      "type": "llm_call",
      "model": "llama-3.3-70b-versatile",
      "prompt_blob": "sha256:aaaa0001000000000000000000000000000000000000000000000000000000aa",
      "response_blob": "sha256:bbbb0001000000000000000000000000000000000000000000000000000000bb",
      "timestamp_ms": 1750250000000,
      "latency_ms": 810,
      "token_usage": { "prompt": 980, "completion": 290 },
      "confidence": 0.91,
      "side_effecting": false,
      "causal_parents": [],
      "status": "ok",
      "parallel_group": null
    },
    {
      "step_id": 2,
      "type": "tool_call",
      "tool": "get_ticket",
      "transport": "http",
      "args_blob": "sha256:cccc0002000000000000000000000000000000000000000000000000000000cc",
      "result_blob": "sha256:dddd0002000000000000000000000000000000000000000000000000000000dd",
      "timestamp_ms": 1750250000815,
      "latency_ms": 200,
      "side_effecting": false,
      "causal_parents": [1],
      "status": "ok",
      "confidence": null,
      "parallel_group": "pg-demo-001"
    },
    {
      "step_id": 3,
      "type": "tool_call",
      "tool": "get_user",
      "transport": "http",
      "args_blob": "sha256:eeee0003000000000000000000000000000000000000000000000000000000ee",
      "result_blob": "sha256:ffff0003000000000000000000000000000000000000000000000000000000ff",
      "timestamp_ms": 1750250000850,
      "latency_ms": 350,
      "side_effecting": false,
      "causal_parents": [1],
      "status": "ok",
      "confidence": null,
      "parallel_group": "pg-demo-001"
    },
    {
      "step_id": 4,
      "type": "tool_call",
      "tool": "get_priority",
      "transport": "http",
      "args_blob": "sha256:aaab0004000000000000000000000000000000000000000000000000000000ab",
      "result_blob": "sha256:bbbc0004000000000000000000000000000000000000000000000000000000bc",
      "timestamp_ms": 1750250001200,
      "latency_ms": 385,
      "side_effecting": false,
      "causal_parents": [1],
      "status": "ok",
      "confidence": null,
      "parallel_group": "pg-demo-001"
    },
    {
      "step_id": 5,
      "type": "llm_call",
      "model": "llama-3.3-70b-versatile",
      "prompt_blob": "sha256:cccd0005000000000000000000000000000000000000000000000000000000cd",
      "response_blob": "sha256:ddde0005000000000000000000000000000000000000000000000000000000de",
      "timestamp_ms": 1750250001590,
      "latency_ms": 230,
      "token_usage": { "prompt": 1400, "completion": 180 },
      "confidence": 0.87,
      "side_effecting": false,
      "causal_parents": [2, 3, 4],
      "status": "ok",
      "parallel_group": null
    }
  ]
}
